{
  "$schema": "https://json-schema.org/draft/2020-12/schema",
  "title": "Joshu App Manifest",
  "type": "object",
  "required": ["id", "name", "version", "license", "publisher", "entry"],
  "properties": {
    "id": { "type": "string", "pattern": "^[a-z0-9-]+$" },
    "name": { "type": "string" },
    "version": { "type": "string" },
    "license": {
      "type": "string",
      "enum": ["AGPL-3.0", "MIT", "proprietary"]
    },
    "publisher": { "type": "string", "description": "Display publisher slug" },
    "entry": { "type": "string", "description": "HTML entry relative to subservice folder" },
    "apiPrefix": { "type": "string", "description": "Joshu API mount, e.g. /joshu/api/hermes-chat" },
    "description": { "type": "string" },
    "publisherId": {
      "type": "string",
      "description": "Stable publisher account id (catalog Phase 2)"
    },
    "publisherUrl": {
      "type": "string",
      "format": "uri",
      "description": "Publisher support or product page"
    },
    "copyright": {
      "type": "string",
      "description": "Copyright line for About / catalog"
    },
    "runtime": {
      "type": "string",
      "enum": ["static", "binary", "proxy"],
      "description": "How the subservice is launched (default: static)"
    },
    "minJoshuVersion": {
      "type": "string",
      "description": "Minimum box stack semver required"
    },
    "bundleSha256": {
      "type": "string",
      "pattern": "^[a-f0-9]{64}$",
      "description": "Integrity hash for sideload bundle (Phase 2)"
    },
    "pricing": {
      "type": "object",
      "properties": {
        "model": { "type": "string", "enum": ["free", "paid", "subscription"] },
        "sku": { "type": "string", "description": "Store SKU or Stripe price id" }
      },
      "required": ["model"]
    },
    "data": {
      "type": "object",
      "description": "Platform data plane domains this app consumes",
      "properties": {
        "uses": {
          "type": "array",
          "items": {
            "type": "string",
            "enum": ["mail", "calendar", "files", "memory", "connections"]
          }
        },
        "mail": {
          "type": "object",
          "properties": {
            "accounts": { "type": "string", "description": "any | nylas | gmail" }
          }
        }
      }
    },
    "agent": {
      "type": "object",
      "description": "Agent integration: skills, headless actions, voice intents",
      "properties": {
        "skill": {
          "type": "string",
          "description": "Bundled app skill name (installed to HERMES_HOME/skills/apps/<id>/)"
        },
        "usesSkills": {
          "type": "array",
          "items": { "type": "string" },
          "description": "Platform skills to load (e.g. joshu-mail, joshu-brain)"
        },
        "headless": { "type": "boolean", "description": "No desktop window required for actions" },
        "guiActions": {
          "type": "array",
          "items": {
            "type": "object",
            "required": ["name"],
            "properties": {
              "name": { "type": "string" },
              "description": { "type": "string" },
              "parameters": {
                "type": "array",
                "items": {
                  "type": "object",
                  "required": ["name"],
                  "properties": {
                    "name": { "type": "string" },
                    "type": { "enum": ["string", "number", "boolean", "object"] },
                    "description": { "type": "string" },
                    "required": { "type": "boolean" }
                  }
                }
              },
              "voice": {
                "type": "object",
                "required": ["phrases"],
                "properties": {
                  "shortcut": { "type": "string", "description": "Gemini tool suffix (app_{appId}_{shortcut})" },
                  "phrases": { "type": "array", "items": { "type": "string" } },
                  "description": { "type": "string" }
                }
              }
            }
          }
        },
        "voiceCommands": {
          "type": "array",
          "description": "Deprecated — prefer guiActions[].voice",
          "items": {
            "type": "object",
            "required": ["name", "phrases", "action"],
            "properties": {
              "name": { "type": "string" },
              "phrases": { "type": "array", "items": { "type": "string" } },
              "action": { "type": "string" },
              "params": { "type": "array", "items": { "type": "string" } },
              "description": { "type": "string" }
            }
          }
        },
        "intents": {
          "type": "array",
          "items": {
            "type": "object",
            "required": ["phrase", "action"],
            "properties": {
              "phrase": { "type": "string" },
              "action": { "type": "string" }
            }
          }
        },
        "actions": {
          "type": "array",
          "items": {
            "type": "object",
            "required": ["name"],
            "properties": {
              "name": { "type": "string" },
              "description": { "type": "string" },
              "handler": { "type": "string", "description": "Optional server handler id (default: name)" }
            }
          }
        }
      }
    }
  }
}
