{
  "id": "boss-mode",
  "name": "Multiplayer",
  "version": "0.1.0",
  "license": "AGPL-3.0",
  "publisher": "joshu",
  "entry": "boss-mode/index.html",
  "apiPrefix": "/joshu/api/teams",
  "description": "See each Multiplayer team: the group chat of the companions and the board of the team's work"
}
